{
  "schema_version": 1,
  "period_key": "2026-09-29",
  "subject_key": "example-owner",
  "title": "Example report",
  "produced_at": "2026-09-29T09:05:00-05:00",
  "status": "complete",
  "idempotency_key": "example-envelope-2026-09-29",
  "coverage": {},
  "payload": {
    "markdown": "Example report body."
  }
}
